{
  "step": "f3_step_5",
  "theme_id": "tema_01_pointing_precoce",
  "domain": "clinico (neuropsviluppo, psicologia dell'infanzia, terapia della comunicazione precoce)",
  "source_output_id": "indistinguibility-test-v1 (f3_step_4) — basato su tema-01-pointing-clinico-dispositivo-v2",
  "case_audits": [
    {
      "case_id": "caso_A",
      "checks": {
        "completeness": {
          "result": "completo",
          "notes": "Tutti i campi obbligatori sono presenti: observed_configuration (con i 5 nodi: corporeità_vissuta, campo_intenzionale, co_regolazione, mediazione_simbolica, passaggio_trasformativo), proxy_analysis con tutti i sotto-campi richiesti (proxies_present con 4 proxy, proxies_direction implementata come 'indicates' per proxy + 'why_proxies_indicate_openness' come motivazione complessiva, counter_indicator come 'mandatory_counter_indicator.potential_alternative_reading', counter_indicator_rebuttal come 'why_discarded', proxy_confidence con decisive_proxy/observability/observability_rationale, classification_status con rationale, ambiguity_conditions con 3 condizioni, classification), device_discrimination, failure_risk."
        },
        "triangulation": {
          "result": "reale",
          "notes": "I quattro elementi sono presenti e sostantivamente articolati. (1) proxies_present: 4 proxy distinti (non-prevedibilità, asimmetria dinamica, ridefinizione in corso d'opera, sospensione strutturale), ciascuno con evidence_in_case specifica. (2) proxies_direction: ogni proxy dichiara 'indicates: apertura' ed è sostenuto da 'why_proxies_indicate_openness' che articola il legame strutturale tra proxy e classe in modo non tautologico (es: 'la non-prevedibilità è incompatibile con uno script perché uno script minimizza non-prevedibilità'). (3) counter_indicator: reale e specifico — 'la sequenza pointing-nominazione-vocalizzazione-commento è una struttura diadica ricorrente in molte interazioni con questo caregiver e potrebbe essere letta come uno script abituale di tipo show-and-tell'. (4) counter_indicator_rebuttal: risponde effettivamente al contro-indicatore — 'la ripresa del caregiver è inflessa dalla qualità di stupore aggiunta dal bambino, che non era prevista dalla nominazione iniziale; se fosse stato esecuzione dello script la sequenza si sarebbe chiusa sulla nominazione'. Il rebuttal non aggira il contro-indicatore ma identifica un elemento strutturale (la ridefinizione effettiva) che lo distingue."
        },
        "proxy_validity": {
          "result": "parzialmente_validi",
          "notes": "I quattro proxy sono prevalentemente ancorati alla narrative_thick_description, non solo alla observed_configuration. Tuttavia la narrative_thick_description contiene in alcuni passaggi espressioni che sono già letture strutturali ('una qualità di stupore che non era nella nominazione neutra del caregiver', 'qualcosa è stato co-prodotto in quel momento e entrambi lo sanno'), quindi l'ancoraggio non è sempre puramente fenomenico ma talvolta a frasi che già incorporano la classificazione. Questo introduce un rischio di circolarità localizzata: la narrative supporta i proxy con elementi che sono essi stessi parzialmente interpretativi. Il rischio è circoscritto perché la maggior parte degli ancoraggi è a elementi descrittivi (postura, sequenza dei movimenti, qualità prosodiche), ma va segnalato.",
          "evidence_anchors": [
            {
              "proxy_name": "non-prevedibilità della sequenza",
              "evidence_element": "narrative: 'Il caregiver coglie questa ripresa e la riprende a sua volta: sì, guarda come si muove! — il commento del caregiver è inflesso dalla vocalizzazione del bambino, non era previsto come passo successivo dello script'",
              "anchor_source": "case_description"
            },
            {
              "proxy_name": "asimmetria dinamica del lavoro semiotico",
              "evidence_element": "narrative: 'Il bambino fa un piccolo movimento del corpo verso la finestra come a dire guardalo. Il caregiver coglie questa ripresa e la riprende a sua volta' — descrive lo spostamento del contributo tra bambino e caregiver",
              "anchor_source": "case_description"
            },
            {
              "proxy_name": "ridefinizione in corso d'opera",
              "evidence_element": "narrative: 'una qualità di stupore che non era nella nominazione neutra del caregiver' — l'evidenza è ancorata alla narrative ma la frase contiene già una valutazione strutturale ('non era nella nominazione neutra') che è in parte interpretativa",
              "anchor_source": "case_description"
            },
            {
              "proxy_name": "tracce di sospensione strutturale",
              "evidence_element": "narrative: 'il braccio resta sospeso un istante più di quanto la pura segnalazione richiederebbe: il braccio non torna giù subito, mantiene una struttura di richiamo' e 'Il bambino fa una micro-pausa nella vocalizzazione che stava per iniziare — la pausa non è inerzia, è ascolto attivo'",
              "anchor_source": "case_description"
            }
          ]
        },
        "decisive_proxy_counter_reading": {
          "decisive_proxy": "ridefinizione in corso d'opera, sostenuta dall'asimmetria dinamica del lavoro semiotico",
          "counter_reading": "Lo stesso elemento — il commento del caregiver 'guarda come si muove' che segue la nominazione 'è un uccellino' — potrebbe essere riletto come parte dello script standard 'show-and-tell' espanso: in molte diadi il pattern non è solo 'nomina e chiudi' ma 'nomina + commenta deitticamente'. In questa lettura, il commento non sarebbe inflesso dalla vocalizzazione del bambino ma sarebbe il secondo turno previsto della formula. Anche la 'micro-pausa' del bambino potrebbe essere riletta come latenza neutra anziché come ascolto attivo. La distinzione tra 'inflessione dalla vocalizzazione' e 'formula bipartita standard' è qualitativa e prosodica, non desumibile da elementi pienamente univoci nella case_description.",
          "result": "proxy_decisivo_reversibile"
        },
        "proxy_classification_coherence": {
          "result": "coerente",
          "notes": "I 4 proxy puntano tutti coerentemente verso 'apertura'. La classificazione 'aperto' segue dai proxy, non li precede — non si rilevano segni di razionalizzazione a posteriori. Il decisive_proxy dichiarato (ridefinizione + asimmetria) è esplicitamente discriminante per la classe."
        },
        "proxy_confidence_check": {
          "result": "giustificata",
          "notes": "proxy_confidence='media' è giustificata da observability_rationale specifico: 'la ridefinizione richiede di leggere lo scambio nella sua totalità qualitativa — riconoscere che il commento del caregiver è inflesso dalla vocalizzazione del bambino richiede attenzione qualitativa specifica. Non è direttamente leggibile in un singolo fotogramma o in una trascrizione che riporti solo il contenuto verbale.' Il legame tra natura qualitativa del proxy decisivo e valore 'media' è esplicito e ragionato."
        },
        "classification_status_check": {
          "result": "corretto",
          "notes": "proxy_confidence='media' → classification_status='probabile'. Corrispondenza rispettata. La motivazione è esplicita: 'lo status non è netto perché il proxy decisivo ha osservabilità media: la classificazione dipende dalla qualità dell'osservazione qualitativa'."
        },
        "ambiguity_handling": {
          "result": "corretta",
          "notes": "Tre ambiguity_conditions esplicite e specifiche: (a) osservazione limitata al contenuto verbale → proxy decisivo perde osservabilità → ambiguo; (b) prima osservazione della diade senza baseline → non-prevedibilità non triangolabile → ambiguo; (c) disturbo del setting che riduce leggibilità di micro-sospensioni → ambiguo. Le condizioni sono ancorate a elementi specifici del proxy decisivo, non generiche."
        },
        "false_positive_risk": {
          "result": "gestito",
          "notes": "failure_risk presente con 4 condizioni specifiche, inclusa la condizione canonica del rischio di falso positivo: 'se l'osservatore opera con una checklist comportamentale (presenza di pointing, presenza di sguardo di riferimento, presenza di risposta verbale) il caso viene classificato come pointing tipico con risposta adeguata senza che la struttura del passaggio venga interrogata'. Il caso è esplicitamente segnalato come 'facilmente positivo' sui nodi standard e questo è problematizzato. È inoltre indicato che 'l'esito corretto non è classificare aperto di default ma dichiarare l'ambiguità' quando il proxy decisivo perde osservabilità."
        }
      }
    },
    {
      "case_id": "caso_B",
      "checks": {
        "completeness": {
          "result": "completo",
          "notes": "Tutti i campi obbligatori sono presenti. observed_configuration include i 5 nodi (con co_regolazione esplicitamente dichiarata in 'ambiguità tra partecipativa e chiudente' e mediazione_simbolica come 'distorta'). proxy_analysis è completa con 4 proxy, mandatory_counter_indicator + secondary_counter_indicator (oltre il minimo richiesto), proxy_confidence, classification_status='probabile' con rationale, 4 ambiguity_conditions, classification='predeterminato'. device_discrimination e failure_risk presenti con 5 condizioni di fallimento."
        },
        "triangulation": {
          "result": "reale",